{
  "$schema": "http://json-schema.org/draft-07/schema#",
  "title": "PolicyChunk",
  "description": "Single chunk of regulation text for RAG retrieval",
  "type": "object",
  "required": ["text", "source", "country", "category"],
  "properties": {
    "text": {
      "type": "string",
      "description": "Clean regulation text (one clause or coherent segment)"
    },
    "source": {
      "type": "string",
      "description": "Regulatory authority (e.g. FDA, EMA, CDSCO, ICH, EU, HHS)"
    },
    "country": {
      "type": "string",
      "enum": ["USA", "EU", "India", "International"],
      "description": "Jurisdiction"
    },
    "category": {
      "type": "string",
      "description": "Category from taxonomy (e.g. Promotion, Adverse events, Privacy)"
    },
    "source_id": {
      "type": "string",
      "description": "Optional: id from sources_metadata.json"
    },
    "chunk_index": {
      "type": "integer",
      "description": "Order within source document"
    },
    "page_start": {
      "type": "integer",
      "description": "First page number in original PDF (1-based)"
    },
    "page_end": {
      "type": "integer",
      "description": "Last page number in original PDF (1-based)"
    }
  }
}
