[
  {
    "text": "Best Practices for FDA Staff in \nthe Postmarketing Safety \nSurveillance of Human Drug \nand Biological Products \nU.S. Department of Health and Human Services \nFood and Drug Administration \nCenter for Drug Evaluation and Research (CDER) \nCenter for Biologics Evaluation and Research (CBER) \nJanuary 2024 \nDrug Safety\n\nBest Practices for FDA Staff in \nthe Postmarketing Safety \nSurveillance of Human Drug \nand Biological Products \nAdditional copies are available from: \nOffice of Communications, Division of Drug Information \nCenter for Drug Evaluation and Research \nFood and Drug Administration \n10001 New Hampshire Ave., Hillandale Bldg., 4th Floor \nSilver Spring, MD 20993 -0002 \nPhone: 855 -543-3784 or 301 -796-3400; Fax: 301 -431-6353 \nEmail: druginfo@fda.hhs.gov \nand/or \nOffice of Communication, Outreach and Development \nCenter for Biologics Evaluation and Research \nFood and Drug Administration \n10903 New Hampshire Ave., Bldg. 71, Room 3128 \nSilver Spring, MD 20993 -0002 \nPhone: 800 -835-4709 or 240 -402-8010 \nEmail: ocod@fda.hhs.gov \nU.S. Department of Health and Human Services \nFood and Drug Administration \nCenter for Drug Evaluation and Research (CDER) \nCenter for Biologics Evaluation and Research (CBER) \nJanuary 2024 \nDrug Safety\n\nTABLE OF CONTENTS",
    "source": "FDA",
    "country": "USA",
    "category": "Adverse events",
    "source_id": "FDA_postmarketing_surveillance_best_practices",
    "chunk_index": 0
  },
  {
    "text": "1. Executive Summary ............................................................................................................................... 1",
    "source": "FDA",
    "country": "USA",
    "category": "Adverse events",
    "source_id": "FDA_postmarketing_surveillance_best_practices",
    "chunk_index": 1
  },
  {
    "text": "2. Introduction .......................................................................................................................................... 1 \nRegulatory History ........................................................................................................................ 1 \nScope and Goals of This Document .............................................................................................. 2 \nRelated Documents ....................................................................................................................... 3 \nTerms Referenced Throughout Document ................................................................................... 3",
    "source": "FDA",
    "country": "USA",
    "category": "Adverse events",
    "source_id": "FDA_postmarketing_surveillance_best_practices",
    "chunk_index": 2
  },
  {
    "text": "3. FDA’s Adverse Event Reporting Systems .............................................................................................. 4",
    "source": "FDA",
    "country": "USA",
    "category": "Adverse events",
    "source_id": "FDA_postmarketing_surveillance_best_practices",
    "chunk_index": 3
  },
  {
    "text": "4. Risk-based Approach to Drug Safety Surveillance ................................................................................ 5",
    "source": "FDA",
    "country": "USA",
    "category": "Adverse events",
    "source_id": "FDA_postmarketing_surveillance_best_practices",
    "chunk_index": 4
  },
  {
    "text": "5. Special Topics in Drug and Biological Product Safety Surveillance ....................................................... 7 \nBiological Products ........................................................................................................................ 7 \nBiosimilar Products ............................................................................................................... 8 \nGeneric Drug s................................................................................................................................ 8 \nNonprescription Drug Products .................................................................................................. 10 \nOrphan Drugs and Dr ugs for Rare Diseases or Conditions ......................................................... 10 \nCompounded Drugs .................................................................................................................... 11 \nHomeopathic Drug Products ....................................................................................................... 12 \nCombination Products ................................................................................................................ 12 \nMedication Errors ....................................................................................................................... 13 \nSpecific Patient Populations ........................................................................................................ 15 \nPregnant Population ........................................................................................................... 15 \nPediatric Population ............................................................................................................ 17 \nGeriatric Population ............................................................................................................ 18 \nMisuse, Abuse, Addiction, and Overdose ................................................................................... 19 \nProduct Quality Issues ................................................................................................................. 19",
    "source": "FDA",
    "country": "USA",
    "category": "Adverse events",
    "source_id": "FDA_postmarketing_surveillance_best_practices",
    "chunk_index": 5
  },
  {
    "text": "6. Safety Signal Identification ................................................................................................................. 20 \nData Sources ............................................................................................................................... 20 \nFAERS and VAERS ................................................................................................................ 20 \nData Mining ......................................................................................................................... 21 \nMedical Literature ............................................................................................................... 22\n\nFrequency and Extent of Screening ............................................................................................ 24 \nSignal P rioritization ..................................................................................................................... 25",
    "source": "FDA",
    "country": "USA",
    "category": "Adverse events",
    "source_id": "FDA_postmarketing_surveillance_best_practices",
    "chunk_index": 6
  },
  {
    "text": "7. Signal Evaluation and Documentation ................................................................................................ 26 \nFAERS, VAERS, and the Medical Literature ................................................................................. 26 \nICSR Retrieval ...................................................................................................................... 26 \nCase Definition .................................................................................................................... 26 \nAssessment of ICSRs for Causal Association ....................................................................... 27 \nCase Series .......................................................................................................................... 27 \nProduct Utilization ...................................................................................................................... 28 \nReporting Ratios .......................................................................................................................... 28 \nEpidemiologic Assessments ........................................................................................................ 29",
    "source": "FDA",
    "country": "USA",
    "category": "Adverse events",
    "source_id": "FDA_postmarketing_surveillance_best_practices",
    "chunk_index": 7
  },
  {
    "text": "8. Causal Association Between Product and AE ..................................................................................... 29",
    "source": "FDA",
    "country": "USA",
    "category": "Adverse events",
    "source_id": "FDA_postmarketing_surveillance_best_practices",
    "chunk_index": 8
  },
  {
    "text": "9. Actions ................................................................................................................................................ 30 \nProduct Labeling Changes ........................................................................................................... 30 \nSafety Communications .............................................................................................................. 31 \nPostmarketing Studies and Trials ................................................................................................ 32 \nEnhanced Pharmacovigilance Activities ...................................................................................... 32 \nWeb Posting of Potential Safety Signals ..................................................................................... 32 \nRisk Evaluation and Mitigation Strategies .................................................................................. 33",
    "source": "FDA",
    "country": "USA",
    "category": "Adverse events",
    "source_id": "FDA_postmarketing_surveillance_best_practices",
    "chunk_index": 9
  },
  {
    "text": "1\n0. Exploring New Approaches ................................................................................................................. 34",
    "source": "FDA",